{"artifact_replay":{"blocked":10,"case_count":12,"eligible":0,"executed":0,"not_applicable":2,"status":"not_run"},"blinded_rerun":{"blocked":0,"case_count":12,"holdout_eligible":0,"paired_runs_executed":0,"regression_only":12,"status":"not_run"},"case_matrix_hash":"sha256:32715e1065aadae1c3b6638f10559c735cf920d0f9a9f6aa34b05bf14d96e24b","claims":{"architecture_conformance":"demonstrated","demonstrated_efficacy":"not_demonstrated","historical_reconstruction":"not_demonstrated","prospective_release":"not_qualified","regression_parity":"not_demonstrated"},"evaluation_id":"decision5-retrospective-v1","hard_gates":{"artifact_integrity_violations":null,"known_clean_invalid_accepts":null,"report_link_violations":null,"safety_violations":0,"secrets_stored":0,"unsupported_impact_regression":"not_measured"},"inventory_hash":"sha256:fb104b9cc435914ebca552df8d87515e74a222ab18876701a8789457682a8e8b","policy":{"artifact_execution":false,"invented_results":false,"target_contact":false,"zone2_creation":false},"record_reconstruction":{"exact_resume":"not_run","invented_attempts":0,"needs_review":136154,"representable":0,"source_bytes_modified":false,"source_count":136154},"schema_version":1}
